{
  "schema_version": "1.1",
  "project_id": "002-the-new-war-beneath-the-ocean",
  "status": "materialized",
  "purpose": "Exclusive-medium rebalance of every baseline graphic/card moment. No replacement may be materialized until its request passes provenance and semantic review.",
  "baseline": {
    "shot_count": 150,
    "duration_frames": 31128,
    "duration_seconds": 1037.6,
    "contextual_footage_seconds": 592.2666666666667,
    "contextual_footage_fraction": 0.5708044204574659,
    "primary_evidence_seconds": 59.36666666666667,
    "primary_evidence_fraction": 0.0572153687997944,
    "graphic_card_seconds": 385.96666666666664,
    "graphic_card_fraction": 0.3719802107427397,
    "full_screen_text_card_seconds": 59.5,
    "full_screen_text_card_fraction": 0.05734387047031612
  },
  "projected": {
    "duration_frames": 31037,
    "duration_seconds": 1034.5666666666666,
    "contextual_footage_seconds": 632.7,
    "contextual_footage_fraction": 0.6115603956567968,
    "primary_evidence_seconds": 262.8,
    "primary_evidence_fraction": 0.25401939620453007,
    "graphic_card_seconds": 139.06666666666666,
    "graphic_card_fraction": 0.1344202081386732,
    "full_screen_text_card_seconds": 25,
    "full_screen_text_card_fraction": 0.024164706640461386,
    "maximum_consecutive_graphic_card_shots": 1
  },
  "actions": [
    {
      "shot_key": "body:clm-001-japan-technical-milestone:unsliced:sec-01-mud-to-daylight:occ-1",
      "baseline_shot_index": 6,
      "claim_id": "CLM_001_JAPAN_TECHNICAL_MILESTONE",
      "duration_seconds": 2,
      "decision": "redesign",
      "projected_medium": "graphic_card",
      "projected_full_screen_text_card": true,
      "template_id": "orvyq_section_sting",
      "rationale": "Keep one compact opening section sting; remove the presentation-style box treatment."
    },
    {
      "shot_key": "body:clm-001-japan-technical-milestone:slice-4:pause-it-was-looking-for-a-way-out:occ-1",
      "baseline_shot_index": 11,
      "claim_id": "CLM_001_JAPAN_TECHNICAL_MILESTONE",
      "duration_seconds": 4,
      "decision": "redesign",
      "projected_medium": "graphic_card",
      "projected_full_screen_text_card": false,
      "template_id": "orvyq_emphasis_lower",
      "rationale": "Retain the authored pause as a restrained overlay on the underlying research context."
    },
    {
      "shot_key": "body:clm-002-china-rare-earth-chokepoint:unsliced:sec-02-chokepoint:occ-1",
      "baseline_shot_index": 15,
      "claim_id": "CLM_002_CHINA_RARE_EARTH_CHOKEPOINT",
      "duration_seconds": 2.5,
      "decision": "redesign",
      "projected_medium": "graphic_card",
      "projected_full_screen_text_card": false,
      "template_id": "orvyq_source_bridge",
      "rationale": "Use a brief source bridge before the verified IEA capture; no document-lookalike card."
    },
    {
      "shot_key": "body:clm-002-china-rare-earth-chokepoint:slice-1:sec-02-chokepoint:occ-1",
      "baseline_shot_index": 17,
      "claim_id": "CLM_002_CHINA_RARE_EARTH_CHOKEPOINT",
      "duration_seconds": 6.266666666666667,
      "decision": "replace_primary_evidence",
      "projected_medium": "primary_evidence",
      "asset_request_id": "REQ_EVD_IEA_MAGNET_SHARE",
      "replacement_assets": [
        {
          "asset_path": "assets/evidence/iea_magnet_share_page31.png",
          "evidence_asset_id": "EVID_IEA_MAGNET_SHARE_OFFICIAL_PAGE",
          "source_region": "Page 31 — mining and refining shares"
        }
      ],
      "rationale": "The concentration claim needs the official IEA chart and highlighted data, not a recreated concept map."
    },
    {
      "shot_key": "body:clm-002-china-rare-earth-chokepoint:slice-3:sec-02-chokepoint:occ-1",
      "baseline_shot_index": 19,
      "claim_id": "CLM_002_CHINA_RARE_EARTH_CHOKEPOINT",
      "duration_seconds": 7.966666666666667,
      "decision": "replace_primary_evidence",
      "projected_medium": "primary_evidence",
      "asset_request_id": "REQ_EVD_IEA_MAGNET_SHARE",
      "replacement_assets": [
        {
          "asset_path": "assets/evidence/iea_magnet_share_page31.png",
          "evidence_asset_id": "EVID_IEA_MAGNET_SHARE_OFFICIAL_PAGE",
          "source_region": "Page 31 — magnet-manufacturing share"
        }
      ],
      "rationale": "Continue through a different, substantively distinct region of the official chart; crop reuse does not count as new evidence."
    },
    {
      "shot_key": "body:clm-002-china-rare-earth-chokepoint:slice-5:sec-02-chokepoint:occ-1",
      "baseline_shot_index": 21,
      "claim_id": "CLM_002_CHINA_RARE_EARTH_CHOKEPOINT",
      "duration_seconds": 7.966666666666667,
      "decision": "redesign",
      "projected_medium": "graphic_card",
      "projected_full_screen_text_card": false,
      "template_id": "orvyq_single_comparison",
      "rationale": "Retain one concise comparison only because the multi-stage chokepoint is faster to understand as a direct comparison."
    },
    {
      "shot_key": "body:clm-003-export-controls-materialized-risk:slice-1:sec-02-chokepoint:occ-1",
      "baseline_shot_index": 23,
      "claim_id": "CLM_003_EXPORT_CONTROLS_MATERIALIZED_RISK",
      "duration_seconds": 7.966666666666667,
      "decision": "replace_primary_evidence",
      "projected_medium": "primary_evidence",
      "asset_request_id": "REQ_EVD_IEA_EXPORT_TIMELINE",
      "replacement_assets": [
        {
          "asset_path": "assets/evidence/iea_export_timeline_page35.png",
          "evidence_asset_id": "EVID_IEA_EXPORT_TIMELINE_OFFICIAL_PAGE",
          "source_region": "Page 35 — export volumes and restriction dates"
        }
      ],
      "rationale": "Show the official chronology and highlighted policy dates instead of a generic source card."
    },
    {
      "shot_key": "body:clm-004-japan-industrial-timeline:slice-2:pause-owning-a-deposit-is-not-the-same-as-controlling-a-supply-chain:occ-1",
      "baseline_shot_index": 28,
      "claim_id": "CLM_004_JAPAN_INDUSTRIAL_TIMELINE",
      "duration_seconds": 2,
      "decision": "redesign",
      "projected_medium": "graphic_card",
      "projected_full_screen_text_card": false,
      "template_id": "orvyq_emphasis_center",
      "rationale": "Keep the pause line as a minimal overlay on industrial footage."
    },
    {
      "shot_key": "body:clm-004-japan-industrial-timeline:slice-3:sec-02-chokepoint:occ-1",
      "baseline_shot_index": 29,
      "claim_id": "CLM_004_JAPAN_INDUSTRIAL_TIMELINE",
      "duration_seconds": 7.7,
      "decision": "replace_primary_evidence",
      "projected_medium": "primary_evidence",
      "asset_request_id": "REQ_EVD_JAMSTEC_SCHEDULE",
      "replacement_assets": [
        {
          "asset_path": "assets/evidence/jamstec_2027_trial_diagram.png",
          "evidence_asset_id": "EVID_JAMSTEC_2027_TRIAL_DIAGRAM",
          "source_region": "Official 2027 integrated-trial diagram"
        }
      ],
      "rationale": "Replace the recap card with the dated JAMSTEC schedule/milestone material and highlight planned versus completed stages."
    },
    {
      "shot_key": "body:clm-005-common-heritage-principle:unsliced:sec-03-black-map:occ-1",
      "baseline_shot_index": 35,
      "claim_id": "CLM_005_COMMON_HERITAGE_PRINCIPLE",
      "duration_seconds": 2.5,
      "decision": "redesign",
      "projected_medium": "graphic_card",
      "projected_full_screen_text_card": false,
      "template_id": "orvyq_source_bridge_alt",
      "rationale": "Use a short bridge into the treaty text, avoiding a static section-card run."
    },
    {
      "shot_key": "body:clm-005-common-heritage-principle:slice-1:sec-03-black-map:occ-1",
      "baseline_shot_index": 37,
      "claim_id": "CLM_005_COMMON_HERITAGE_PRINCIPLE",
      "duration_seconds": 6.933333333333334,
      "decision": "replace_primary_evidence",
      "projected_medium": "primary_evidence",
      "asset_request_id": "REQ_EVD_UNCLOS_ARTICLES",
      "replacement_assets": [
        {
          "asset_path": "assets/evidence/unclos_articles_136_137_page51.png",
          "evidence_asset_id": "EVID_UNCLOS_ARTICLES_136_137_OFFICIAL_PAGE",
          "source_region": "UNTS PDF page 51 — Article 136"
        }
      ],
      "rationale": "Show the official treaty page with Article 136 highlighted."
    },
    {
      "shot_key": "body:clm-005-common-heritage-principle:slice-3:sec-03-black-map:occ-1",
      "baseline_shot_index": 39,
      "claim_id": "CLM_005_COMMON_HERITAGE_PRINCIPLE",
      "duration_seconds": 7.366666666666666,
      "decision": "replace_primary_evidence",
      "projected_medium": "primary_evidence",
      "asset_request_id": "REQ_EVD_UNCLOS_ARTICLES",
      "replacement_assets": [
        {
          "asset_path": "assets/evidence/unclos_articles_136_137_page51.png",
          "evidence_asset_id": "EVID_UNCLOS_ARTICLES_136_137_OFFICIAL_PAGE",
          "source_region": "UNTS PDF page 51 — Article 137"
        }
      ],
      "rationale": "Move to the exact Article 137 ownership language; this is a distinct cited region, not cosmetic recropping."
    },
    {
      "shot_key": "body:clm-005-common-heritage-principle:slice-5:sec-03-black-map:occ-1",
      "baseline_shot_index": 41,
      "claim_id": "CLM_005_COMMON_HERITAGE_PRINCIPLE",
      "duration_seconds": 7.833333333333333,
      "decision": "replace_primary_evidence",
      "projected_medium": "primary_evidence",
      "asset_request_id": "REQ_EVD_UNCLOS_ARTICLES",
      "replacement_assets": [
        {
          "asset_path": "assets/evidence/unclos_articles_136_137_page51.png",
          "evidence_asset_id": "EVID_UNCLOS_ARTICLES_136_137_OFFICIAL_PAGE",
          "source_region": "UNTS PDF page 51 — Authority acts on behalf of mankind"
        }
      ],
      "rationale": "Use the official Area map/treaty context with institution, date, and provenance visible."
    },
    {
      "shot_key": "body:clm-006-mining-code-unfinished:unsliced:sec-04-two-rulebooks:occ-1",